{
  "date": "2026-01-01",
  "participants": [
    "PC_01"
  ],
  "start_hour": "Jour 5 aube",
  "end_hour": "Jour 5 soir",
  "actions": [
    {
      "acteur": "PC_01",
      "action": "ACTION_01"
    }
  ],
  "visited_locations": [
    {
      "name": "LOC_VILLAGE"
    }
  ],
  "resume": "SUMMARY_01",
  "session": 2,
  "npcs_met": [
    {
      "id": "npc:rival",
      "name": "NPC_RIVAL",
      "role_scene": "ROLE_02"
    }
  ]
}
